{
  "type": "agent-state-lineage",
  "gaamVersion": "0.9.0",
  "status": "experimental",
  "normativeStatus": "non-normative",
  "agentId": "agent:001",
  "stateId": "state:002",
  "previousStateId": "state:001",
  "effectiveAt": "2026-07-29T00:00:00Z",
  "components": {
    "model": "model:v2",
    "policy": "policy:v4",
    "tools": [
      "tool:registry"
    ],
    "runtime": "runtime:prod"
  },
  "materiality": "review-required",
  "assuranceInvalidated": false
}
